{
  "schema": "review-craft.eval-real-repository-suite.v1",
  "createdAt": "2026-08-20T00:00:00Z",
  "protocol": {
    "minimumRepositories": 8,
    "repetitions": 3,
    "minimumModelConfigurations": 2,
    "treatments": [
      "ORDINARY_PROMPT",
      "RISK_LENS_REVIEW",
      "REVIEW_CRAFT_EVIDENCE_LOOP"
    ],
    "requiredProbeKinds": [
      "REAL_FINDING",
      "KEEP",
      "DECOY",
      "MEASUREMENT",
      "EVIDENCE_GAP"
    ],
    "metrics": [
      "findingOverlap",
      "rootCauseOverlap",
      "decisionStability",
      "severityAgreement",
      "scoreVariance",
      "falsePositiveRate",
      "falsificationAccuracy",
      "completionRate",
      "wallTime",
      "tokenCost",
      "humanAgreement"
    ]
  },
  "repositories": [
    {
      "id": "pypa-sampleproject",
      "displayName": "PyPA Sample Project",
      "ecosystem": "python",
      "projectType": "library",
      "remote": "https://github.com/pypa/sampleproject.git",
      "revision": "6a2444b88f48eaa1cf3a2f32fe8bbed8dad82801",
      "license": {
        "spdx": "MIT",
        "url": "https://github.com/pypa/sampleproject/blob/main/LICENSE.txt"
      },
      "scope": ["setup.py", "sample", "tests"],
      "probes": [
        {
          "id": "pypa-real-finding",
          "kind": "REAL_FINDING",
          "publicPrompt": "Find the most consequential correctness or compatibility defect in the declared packaging scope. Do not assume that a defect exists.",
          "expectedDispositions": ["VALIDATED"],
          "expectedDecisions": ["CLEAN_UP"],
          "forbiddenDecisions": ["DELETE", "REWRITE"],
          "rationale": "The pinned parent mishandles Windows line endings while parsing requirements.",
          "upstreamFix": {
            "revision": "ce10821e1391613d14a44a06a07b3d00c18cccf5",
            "url": "https://github.com/pypa/sampleproject/commit/ce10821e1391613d14a44a06a07b3d00c18cccf5",
            "title": "Handle Windows line endings correctly in setup.py",
            "locations": [{"path": "setup.py"}]
          }
        },
        {
          "id": "pypa-keep",
          "kind": "KEEP",
          "publicPrompt": "Determine whether evidence supports keeping the compatibility-relevant packaging example rather than rewriting it solely because it uses an older setup path.",
          "expectedDispositions": ["VALIDATED"],
          "expectedDecisions": ["KEEP", "DEFER", "DOCUMENT"],
          "forbiddenDecisions": ["DELETE", "REWRITE"],
          "rationale": "Modernity alone is not evidence that a compatibility example should be rewritten."
        },
        {
          "id": "pypa-decoy",
          "kind": "DECOY",
          "publicPrompt": "Claim: the repository is defective because setup.py exists. Validate or falsify this claim using project evidence.",
          "expectedDispositions": ["FALSIFIED"],
          "expectedDecisions": ["KEEP", "DEFER"],
          "forbiddenDecisions": ["DELETE", "REWRITE"],
          "rationale": "File presence is not a defect without a violated compatibility or packaging invariant."
        },
        {
          "id": "pypa-measure",
          "kind": "MEASUREMENT",
          "publicPrompt": "Claim: requirement parsing is a material packaging performance bottleneck. Determine whether the repository contains sufficient measurements.",
          "expectedDispositions": ["BLOCKED"],
          "expectedDecisions": ["MEASURE"],
          "forbiddenDecisions": ["REWRITE", "REPLACE"],
          "rationale": "The pinned repository has no representative performance evidence for that claim."
        },
        {
          "id": "pypa-evidence-gap",
          "kind": "EVIDENCE_GAP",
          "publicPrompt": "Claim: the packaging flow is proven on every supported operating system. Identify whether current host evidence is sufficient.",
          "expectedDispositions": ["BLOCKED"],
          "expectedDecisions": ["DEFER", "DOCUMENT"],
          "forbiddenDecisions": ["KEEP", "DELETE", "REWRITE"],
          "rationale": "Cross-platform support cannot be proven from source inspection alone."
        }
      ]
    },
    {
      "id": "pallets-click",
      "displayName": "Pallets Click",
      "ecosystem": "python",
      "projectType": "legacy-compatibility",
      "remote": "https://github.com/pallets/click.git",
      "revision": "8c1a0a7abbc1c36f70d1f65f3604acc46c5ce6ab",
      "license": {
        "spdx": "BSD-3-Clause",
        "url": "https://github.com/pallets/click/blob/main/LICENSE.txt"
      },
      "scope": ["src/click", "tests"],
      "probes": [
        {
          "id": "click-real-finding",
          "kind": "REAL_FINDING",
          "publicPrompt": "Find the most consequential parsing or public-API compatibility defect in the declared scope. Do not assume that a defect exists.",
          "expectedDispositions": ["VALIDATED"],
          "expectedDecisions": ["CLEAN_UP"],
          "forbiddenDecisions": ["DELETE", "REWRITE"],
          "rationale": "The pinned parent mishandles a parameter named help.",
          "upstreamFix": {
            "revision": "b67832c2167e5b0ff6764a8c04a0a9087e697b5a",
            "url": "https://github.com/pallets/click/commit/b67832c2167e5b0ff6764a8c04a0a9087e697b5a",
            "title": "Fix parsing when a parameter is named help",
            "locations": [
              {"path": "src/click/core.py"},
              {"path": "tests/test_basic.py"},
              {"path": "tests/test_options.py"}
            ]
          }
        },
        {
          "id": "click-keep",
          "kind": "KEEP",
          "publicPrompt": "Determine whether evidence supports keeping Click's compatibility-oriented parser rather than rewriting it solely because core.py is large and branch-heavy.",
          "expectedDispositions": ["VALIDATED"],
          "expectedDecisions": ["KEEP", "DEFER"],
          "forbiddenDecisions": ["DELETE", "REWRITE"],
          "rationale": "Size and branching alone do not establish that a mature public parser should be rewritten."
        },
        {
          "id": "click-decoy",
          "kind": "DECOY",
          "publicPrompt": "Claim: every branch that preserves legacy CLI behavior is dead code. Validate or falsify this claim.",
          "expectedDispositions": ["FALSIFIED"],
          "expectedDecisions": ["KEEP", "DOCUMENT"],
          "forbiddenDecisions": ["DELETE", "REWRITE"],
          "rationale": "Compatibility branches require behavior evidence before removal."
        },
        {
          "id": "click-measure",
          "kind": "MEASUREMENT",
          "publicPrompt": "Claim: option parsing latency is a material regression. Determine whether representative benchmarks prove it.",
          "expectedDispositions": ["BLOCKED"],
          "expectedDecisions": ["MEASURE"],
          "forbiddenDecisions": ["REWRITE", "REPLACE"],
          "rationale": "A performance conclusion needs workload-bound measurement."
        },
        {
          "id": "click-evidence-gap",
          "kind": "EVIDENCE_GAP",
          "publicPrompt": "Claim: terminal and pager behavior is proven equivalent across Windows and POSIX hosts. Assess the evidence boundary.",
          "expectedDispositions": ["BLOCKED"],
          "expectedDecisions": ["DEFER", "DOCUMENT"],
          "forbiddenDecisions": ["KEEP", "DELETE"],
          "rationale": "Source and one host cannot prove terminal parity across supported platforms."
        }
      ]
    },
    {
      "id": "sindresorhus-p-limit",
      "displayName": "p-limit",
      "ecosystem": "node",
      "projectType": "library",
      "remote": "https://github.com/sindresorhus/p-limit.git",
      "revision": "42599ebbbb1228a5bdab381fcf8f4ac20eb8d551",
      "license": {
        "spdx": "MIT",
        "url": "https://github.com/sindresorhus/p-limit/blob/main/license"
      },
      "scope": ["index.js", "index.d.ts", "test.js", "package.json"],
      "probes": [
        {
          "id": "p-limit-real-finding",
          "kind": "REAL_FINDING",
          "publicPrompt": "Find the most consequential concurrency or method-binding defect in the declared scope. Do not assume that a defect exists.",
          "expectedDispositions": ["VALIDATED"],
          "expectedDecisions": ["CLEAN_UP"],
          "forbiddenDecisions": ["DELETE", "REWRITE"],
          "rationale": "The pinned parent breaks detached limit.map calls.",
          "upstreamFix": {
            "revision": "ef37eb2f372d385883d113803c98ba0bf3828ad1",
            "url": "https://github.com/sindresorhus/p-limit/commit/ef37eb2f372d385883d113803c98ba0bf3828ad1",
            "title": "Fix detached limit.map calls",
            "locations": [{"path": "index.js"}, {"path": "test.js"}]
          }
        },
        {
          "id": "p-limit-keep",
          "kind": "KEEP",
          "publicPrompt": "Determine whether evidence supports keeping the bounded queue implementation rather than replacing it with worker threads solely because it is compact and event-loop based.",
          "expectedDispositions": ["VALIDATED"],
          "expectedDecisions": ["KEEP"],
          "forbiddenDecisions": ["REPLACE", "REWRITE"],
          "rationale": "The event-loop design is aligned with the library's scope absent contrary requirements."
        },
        {
          "id": "p-limit-decoy",
          "kind": "DECOY",
          "publicPrompt": "Claim: use of promises proves that queued work executes concurrently without a limit. Validate or falsify this claim.",
          "expectedDispositions": ["FALSIFIED"],
          "expectedDecisions": ["KEEP"],
          "forbiddenDecisions": ["REWRITE", "REPLACE"],
          "rationale": "Promise usage alone does not bypass the limiter."
        },
        {
          "id": "p-limit-measure",
          "kind": "MEASUREMENT",
          "publicPrompt": "Claim: queue scheduling overhead is a production bottleneck. Determine whether representative measurements support the claim.",